game_id,word_index,target_word,part_of_speech,category,hinter_model,guesser_model,success,turns_used,final_guess,failure_reason,taboo_violation_turn,taboo_violation_hint,has_taboo_violation,all_hints,all_guesses,conversation,total_api_attempts,format_errors,has_format_errors,duration_seconds,timestamp,language,dataset_source,taboo_words,char_count,error
166,11,捂住,verb,chinese_general,google/gemini-2.5-flash,google/gemini-2.5-flash,False,5,捂,MAX_TURNS_EXCEEDED,None,None,False,用手把嘴巴或耳朵盖上 | 动作不让声音或光线出去 | 比如用手把眼睛闭上不看 | 比如用被子把脸盖住不让冷风进来 | 紧紧地按住不让漏出,捂 | 遮挡 | 蒙 | 盖 | 捂,第1轮 线索: 用手把嘴巴或耳朵盖上 猜测: 捂 | 第2轮 线索: 动作不让声音或光线出去 猜测: 遮挡 | 第3轮 线索: 比如用手把眼睛闭上不看 猜测: 蒙 | 第4轮 线索: 比如用被子把脸盖住不让冷风进来 猜测: 盖 | 第5轮 线索: 紧紧地按住不让漏出 猜测: 捂,12,,False,10.12,2025-07-22 22:11:10,chinese,openhownet,遮盖|东西|事物|物品|概念,2,
167,11,捂住,verb,chinese_general,google/gemini-2.5-flash,deepseek/deepseek-chat-v3-0324,True,1,捂住,成功,None,None,False,用手或布盖住不让看见或发出声音,捂住,第1轮 线索: 用手或布盖住不让看见或发出声音 猜测: 捂住,2,,False,2.19,2025-07-22 22:11:13,chinese,openhownet,遮盖|东西|事物|物品|概念,2,
168,11,捂住,verb,chinese_general,google/gemini-2.5-flash,moonshotai/kimi-k2,False,5,捂,MAX_TURNS_EXCEEDED,None,None,False,用手把嘴巴或耳朵盖上 | 动作不让声音或光线出来 | 比如用手把脸挡住不让人看到 | 比如用被子把头蒙起来 | 比如用手把耳朵堵住,捂 | 捂 | 捂 | 蒙 | 捂,第1轮 线索: 用手把嘴巴或耳朵盖上 猜测: 捂 | 第2轮 线索: 动作不让声音或光线出来 猜测: 捂 | 第3轮 线索: 比如用手把脸挡住不让人看到 猜测: 捂 | 第4轮 线索: 比如用被子把头蒙起来 猜测: 蒙 | 第5轮 线索: 比如用手把耳朵堵住 猜测: 捂,10,,False,9.32,2025-07-22 22:11:23,chinese,openhownet,遮盖|东西|事物|物品|概念,2,
169,11,捂住,verb,chinese_general,deepseek/deepseek-chat-v3-0324,openai/gpt-4o,True,3,捂住耳朵,成功,None,None,False,手遮面部不让看见 | 用手阻挡视线或声音 | 害羞时用手挡脸的动作  [线索] 听到巨响时的本能反应  [线索] 防止声音进入耳朵的手势,面具 | 屏障 | 捂住耳朵,第1轮 线索: 手遮面部不让看见 猜测: 面具 | 第2轮 线索: 用手阻挡视线或声音 猜测: 屏障 | 第3轮 线索: 害羞时用手挡脸的动作  [线索] 听到巨响时的本能反应  [线索] 防止声音进入耳朵的手势 猜测: 捂住耳朵,9,,False,17.84,2025-07-22 22:11:41,chinese,openhownet,遮盖|东西|事物|物品|概念,2,
170,11,捂住,verb,chinese_general,deepseek/deepseek-chat-v3-0324,google/gemini-2.5-flash,False,5,捂,MAX_TURNS_EXCEEDED,None,None,False,用手挡住不让看 | 害羞时常见的动作 | 听到坏消息时的本能反应  [线索] 防止声音外传的动作  [线索] 成语___耳盗铃的第一个字 | 急救时按压伤口的动作  [线索] 冬天冷风灌进领口的应对方式  [线索] 惊讶时双手突然做出的手势 | 打喷嚏时的礼貌动作  [线索] 闻到异味时捏住鼻子的行为  [线索] 成语___住嘴巴的动词  [线索] 防止受凉时手放在胸口,遮挡 | 捂脸 | 掩 | 捂 | 捂,第1轮 线索: 用手挡住不让看 猜测: 遮挡 | 第2轮 线索: 害羞时常见的动作 猜测: 捂脸 | 第3轮 线索: 听到坏消息时的本能反应  [线索] 防止声音外传的动作  [线索] 成语___耳盗铃的第一个字 猜测: 掩 | 第4轮 线索: 急救时按压伤口的动作  [线索] 冬天冷风灌进领口的应对方式  [线索] 惊讶时双手突然做出的手势 猜测: 捂 | 第5轮 线索: 打喷嚏时的礼貌动作  [线索] 闻到异味时捏住鼻子的行为  [线索] 成语___住嘴巴的动词  [线索] 防止受凉时手放在胸口 猜测: 捂,12,,False,27.42,2025-07-22 22:12:09,chinese,openhownet,遮盖|东西|事物|物品|概念,2,
171,11,捂住,verb,chinese_general,deepseek/deepseek-chat-v3-0324,deepseek/deepseek-chat-v3-0324,False,5,捂,MAX_TURNS_EXCEEDED,None,None,False,用手盖住不让看  [线索] 急救时按压伤口  [线索] 害羞时遮住脸  [线索] 防止声音或光外泄 | 耳朵听到巨响时的本能动作  [线索] 防止气味扩散的厨房操作  [线索] 冬天冷风钻进领口的应对  [线索] 成语___耳盗铃的动词部分 | 打喷嚏时用手挡住的礼貌动作  [线索] 防止秘密被听到的悄悄话姿势  [线索] 烫伤后立即用冷水冲并___住  [线索] 成语___住嘴巴的前半部分  [线索] 小朋友玩捉迷藏藏好后会___住眼睛 | 受惊时本能地挡住双眼  [线索] 煮汤时锅盖沸腾要___一下  [线索] 听到坏消息后___住胸口  [线索] 戴口罩类似的面部防护动作  [线索] 用围巾___住脖子防寒 | 受惊吓时双手挡脸的动词  [线索] 煮饭时蒸汽太大要___锅  [线索] 成语___耳不听的前半部分  [线索] 打哈欠时礼貌性用手___嘴  [线索] 突然强光照射时的反射动作,捂 | 掩 | 捂 | 捂 | 捂,第1轮 线索: 用手盖住不让看  [线索] 急救时按压伤口  [线索] 害羞时遮住脸  [线索] 防止声音或光外泄 猜测: 捂 | 第2轮 线索: 耳朵听到巨响时的本能动作  [线索] 防止气味扩散的厨房操作  [线索] 冬天冷风钻进领口的应对  [线索] 成语___耳盗铃的动词部分 猜测: 掩 | 第3轮 线索: 打喷嚏时用手挡住的礼貌动作  [线索] 防止秘密被听到的悄悄话姿势  [线索] 烫伤后立即用冷水冲并___住  [线索] 成语___住嘴巴的前半部分  [线索] 小朋友玩捉迷藏藏好后会___住眼睛 猜测: 捂 | 第4轮 线索: 受惊时本能地挡住双眼  [线索] 煮汤时锅盖沸腾要___一下  [线索] 听到坏消息后___住胸口  [线索] 戴口罩类似的面部防护动作  [线索] 用围巾___住脖子防寒 猜测: 捂 | 第5轮 线索: 受惊吓时双手挡脸的动词  [线索] 煮饭时蒸汽太大要___锅  [线索] 成语___耳不听的前半部分  [线索] 打哈欠时礼貌性用手___嘴  [线索] 突然强光照射时的反射动作 猜测: 捂,11,,False,41.55,2025-07-22 22:12:51,chinese,openhownet,遮盖|东西|事物|物品|概念,2,
172,11,捂住,verb,chinese_general,deepseek/deepseek-chat-v3-0324,moonshotai/kimi-k2,False,1,None,线索生成失败: 格式验证失败: [手挡不让看],None,None,False,,,,3,,False,4.63,2025-07-22 22:12:56,chinese,openhownet,遮盖|东西|事物|物品|概念,2,
173,11,捂住,verb,chinese_general,moonshotai/kimi-k2,openai/gpt-4o,False,3,None,猜测生成失败: 格式验证失败: [捂耳朵],None,None,False,用手把眼睛闭上 | 用手把嘴挡住 | 听到坏消息时的第一反应,捂眼睛 | 捂嘴巴,第1轮 线索: 用手把眼睛闭上 猜测: 捂眼睛 | 第2轮 线索: 用手把嘴挡住 猜测: 捂嘴巴,8,,False,8.8,2025-07-22 22:13:06,chinese,openhownet,遮盖|东西|事物|物品|概念,2,
174,11,捂住,verb,chinese_general,moonshotai/kimi-k2,google/gemini-2.5-flash,True,3,捂住,成功,None,None,False,用手把脸遮住 | 用手挡住耳朵 | 用手把鼻子也包住,捂脸 | 捂耳朵 | 捂住,第1轮 线索: 用手把脸遮住 猜测: 捂脸 | 第2轮 线索: 用手挡住耳朵 猜测: 捂耳朵 | 第3轮 线索: 用手把鼻子也包住 猜测: 捂住,6,,False,8.59,2025-07-22 22:13:15,chinese,openhownet,遮盖|东西|事物|物品|概念,2,
175,11,捂住,verb,chinese_general,moonshotai/kimi-k2,deepseek/deepseek-chat-v3-0324,True,1,捂住,成功,None,None,False,用手把嘴或耳朵挡上,捂住,第1轮 线索: 用手把嘴或耳朵挡上 猜测: 捂住,2,,False,3.47,2025-07-22 22:13:19,chinese,openhownet,遮盖|东西|事物|物品|概念,2,
176,11,捂住,verb,chinese_general,moonshotai/kimi-k2,moonshotai/kimi-k2,False,5,捂,MAX_TURNS_EXCEEDED,None,None,False,用手掌紧按嘴或眼 | 用手把声音或视线挡上 | 用手把光或声遮住 | 双手贴脸防哭喊 | 用手把脸全包住,捂 | 捂 | 捂 | 捂 | 捂,第1轮 线索: 用手掌紧按嘴或眼 猜测: 捂 | 第2轮 线索: 用手把声音或视线挡上 猜测: 捂 | 第3轮 线索: 用手把光或声遮住 猜测: 捂 | 第4轮 线索: 双手贴脸防哭喊 猜测: 捂 | 第5轮 线索: 用手把脸全包住 猜测: 捂,10,,False,22.25,2025-07-22 22:13:42,chinese,openhownet,遮盖|东西|事物|物品|概念,2,
177,12,告知,verb,chinese_general,openai/gpt-4o,openai/gpt-4o,False,2,None,猜测生成失败: 格式验证失败: [通知],None,None,False,传递信息给他人 | 正式地让别人知道某件事情,消息,第1轮 线索: 传递信息给他人 猜测: 消息,6,,False,6.7,2025-07-22 22:13:49,chinese,openhownet,告诉|东西|事物|物品|概念,2,
178,12,告知,verb,chinese_general,openai/gpt-4o,google/gemini-2.5-flash,False,1,None,猜测生成失败: 格式验证失败: [通知],None,None,False,传递消息或信息给他人,,,4,,False,3.44,2025-07-22 22:13:53,chinese,openhownet,告诉|东西|事物|物品|概念,2,
179,12,告知,verb,chinese_general,openai/gpt-4o,deepseek/deepseek-chat-v3-0324,True,4,告知,成功,None,None,False,传达信息给他人 | 让他人知道某件事情 | 让他人了解某个情况或细节 | 以口头或书面形式让他人知晓,信息 | 通知 | 说明 | 告知,第1轮 线索: 传达信息给他人 猜测: 信息 | 第2轮 线索: 让他人知道某件事情 猜测: 通知 | 第3轮 线索: 让他人了解某个情况或细节 猜测: 说明 | 第4轮 线索: 以口头或书面形式让他人知晓 猜测: 告知,10,,False,16.54,2025-07-22 22:14:10,chinese,openhownet,告诉|东西|事物|物品|概念,2,
180,12,告知,verb,chinese_general,openai/gpt-4o,moonshotai/kimi-k2,False,5,通知,MAX_TURNS_EXCEEDED,None,None,False,传递信息给他人 | 让他人了解某个情况或消息 | 让他人知道某个细节或内容 | 向他人传达某种讯息或情况 | 向他人表达某种内容或情况,通知 | 通知 | 通知 | 通知 | 通知,第1轮 线索: 传递信息给他人 猜测: 通知 | 第2轮 线索: 让他人了解某个情况或消息 猜测: 通知 | 第3轮 线索: 让他人知道某个细节或内容 猜测: 通知 | 第4轮 线索: 向他人传达某种讯息或情况 猜测: 通知 | 第5轮 线索: 向他人表达某种内容或情况 猜测: 通知,10,,False,14.3,2025-07-22 22:14:25,chinese,openhownet,告诉|东西|事物|物品|概念,2,
181,12,告知,verb,chinese_general,google/gemini-2.5-flash,openai/gpt-4o,False,2,None,猜测生成失败: 格式验证失败: [通知],None,None,False,把信息传达给对方 | 让别人知道某个情况,通讯,第1轮 线索: 把信息传达给对方 猜测: 通讯,6,,False,5.08,2025-07-22 22:14:30,chinese,openhownet,告诉|东西|事物|物品|概念,2,
182,12,告知,verb,chinese_general,google/gemini-2.5-flash,google/gemini-2.5-flash,False,3,None,猜测生成失败: 格式验证失败: [告知],None,None,False,把消息传达出去 | 让别人知道一个情况 | 正式地把一个情况说给对方听,信息 | 通知,第1轮 线索: 把消息传达出去 猜测: 信息 | 第2轮 线索: 让别人知道一个情况 猜测: 通知,11,,False,7.33,2025-07-22 22:14:38,chinese,openhownet,告诉|东西|事物|物品|概念,2,
183,12,告知,verb,chinese_general,google/gemini-2.5-flash,deepseek/deepseek-chat-v3-0324,False,5,说明,MAX_TURNS_EXCEEDED,None,None,False,把消息传达给对方 | 让别人知道一个情况 | 正式地把情况说出来 | 我把这个消息告知你 | 书面或口头地把情况说清楚,信息 | 通知 | 宣布 | 传达 | 说明,第1轮 线索: 把消息传达给对方 猜测: 信息 | 第2轮 线索: 让别人知道一个情况 猜测: 通知 | 第3轮 线索: 正式地把情况说出来 猜测: 宣布 | 第4轮 线索: 我把这个消息告知你 猜测: 传达 | 第5轮 线索: 书面或口头地把情况说清楚 猜测: 说明,11,,False,15.8,2025-07-22 22:14:54,chinese,openhownet,告诉|东西|事物|物品|概念,2,
184,12,告知,verb,chinese_general,google/gemini-2.5-flash,moonshotai/kimi-k2,False,5,通告,MAX_TURNS_EXCEEDED,None,None,False,把消息传达出去 | 让别人知道某个情况 | 正式地把信息给出去 | 书面或口头地把内容传达给对方 | 让对方了解通常是重要或官方的,传播 | 通知 | 公布 | 传达 | 通告,第1轮 线索: 把消息传达出去 猜测: 传播 | 第2轮 线索: 让别人知道某个情况 猜测: 通知 | 第3轮 线索: 正式地把信息给出去 猜测: 公布 | 第4轮 线索: 书面或口头地把内容传达给对方 猜测: 传达 | 第5轮 线索: 让对方了解通常是重要或官方的 猜测: 通告,10,,False,19.23,2025-07-22 22:15:14,chinese,openhownet,告诉|东西|事物|物品|概念,2,
185,12,告知,verb,chinese_general,deepseek/deepseek-chat-v3-0324,openai/gpt-4o,False,2,None,猜测生成失败: 格式验证失败: [告知],None,None,False,通知 传达 | 知会 通知对方  [线索] 让某人知道某事  [线索] 消息的传递行为,信息,第1轮 线索: 通知 传达 猜测: 信息,6,,False,8.37,2025-07-22 22:15:23,chinese,openhownet,告诉|东西|事物|物品|概念,2,
186,12,告知,verb,chinese_general,deepseek/deepseek-chat-v3-0324,google/gemini-2.5-flash,False,1,None,猜测生成失败: 格式验证失败: [告知],None,None,False,让人知道信息或情况,,,4,,False,4.34,2025-07-22 22:15:28,chinese,openhownet,告诉|东西|事物|物品|概念,2,
187,12,告知,verb,chinese_general,deepseek/deepseek-chat-v3-0324,deepseek/deepseek-chat-v3-0324,True,3,告知,成功,None,None,False,通知别人消息 | 让别人知道某件事情 | 传达信息给对方知道  [线索] 把情况说给别人听  [线索] 一种信息传递行为  [线索] 让对方知晓某情况,消息 | 通知 | 告知,第1轮 线索: 通知别人消息 猜测: 消息 | 第2轮 线索: 让别人知道某件事情 猜测: 通知 | 第3轮 线索: 传达信息给对方知道  [线索] 把情况说给别人听  [线索] 一种信息传递行为  [线索] 让对方知晓某情况 猜测: 告知,7,,False,15.79,2025-07-22 22:15:44,chinese,openhownet,告诉|东西|事物|物品|概念,2,
188,12,告知,verb,chinese_general,deepseek/deepseek-chat-v3-0324,moonshotai/kimi-k2,False,5,通告,MAX_TURNS_EXCEEDED,None,None,False,让人知道信息或情况 | 把消息说给对方听 | 传达消息给对方  [线索] 使他人知晓某事  [线索] 一种信息传递行为  [线索] 用语言让对方了解 | 上级对下级下达指令  [线索] 正式场合的官方传达  [线索] 通过书面或口头形式晓谕  [线索] 使接收方明确应知内容 | 官方文件中的信息发布  [线索] 将消息正式传达到相关方  [线索] 书面形式的晓谕行为  [线索] 使对方知晓应执行的命令,通知 | 通知 | 通知 | 通知 | 通告,第1轮 线索: 让人知道信息或情况 猜测: 通知 | 第2轮 线索: 把消息说给对方听 猜测: 通知 | 第3轮 线索: 传达消息给对方  [线索] 使他人知晓某事  [线索] 一种信息传递行为  [线索] 用语言让对方了解 猜测: 通知 | 第4轮 线索: 上级对下级下达指令  [线索] 正式场合的官方传达  [线索] 通过书面或口头形式晓谕  [线索] 使接收方明确应知内容 猜测: 通知 | 第5轮 线索: 官方文件中的信息发布  [线索] 将消息正式传达到相关方  [线索] 书面形式的晓谕行为  [线索] 使对方知晓应执行的命令 猜测: 通告,12,,False,35.98,2025-07-22 22:16:20,chinese,openhownet,告诉|东西|事物|物品|概念,2,
189,12,告知,verb,chinese_general,moonshotai/kimi-k2,openai/gpt-4o,False,2,None,猜测生成失败: 格式验证失败: [告知],None,None,False,口头通知别人 | 让对方知道某事,通知,第1轮 线索: 口头通知别人 猜测: 通知,7,,False,6.06,2025-07-22 22:16:27,chinese,openhownet,告诉|东西|事物|物品|概念,2,
190,12,告知,verb,chinese_general,moonshotai/kimi-k2,google/gemini-2.5-flash,False,1,None,猜测生成失败: 格式验证失败: [告知],None,None,False,通知别人某事,,,4,,False,2.49,2025-07-22 22:16:30,chinese,openhownet,告诉|东西|事物|物品|概念,2,
191,12,告知,verb,chinese_general,moonshotai/kimi-k2,deepseek/deepseek-chat-v3-0324,True,3,告知,成功,None,None,False,口头通知 | 让他知道情况 | 让他了解某事,消息 | 通知 | 告知,第1轮 线索: 口头通知 猜测: 消息 | 第2轮 线索: 让他知道情况 猜测: 通知 | 第3轮 线索: 让他了解某事 猜测: 告知,7,,False,11.02,2025-07-22 22:16:42,chinese,openhownet,告诉|东西|事物|物品|概念,2,
192,12,告知,verb,chinese_general,moonshotai/kimi-k2,moonshotai/kimi-k2,False,5,预告,MAX_TURNS_EXCEEDED,None,None,False,口头通知 | 让对方知晓 | 传达消息 | 正式通告 | 提前让他知道,通知 | 信息 | 消息 | 公告 | 预告,第1轮 线索: 口头通知 猜测: 通知 | 第2轮 线索: 让对方知晓 猜测: 信息 | 第3轮 线索: 传达消息 猜测: 消息 | 第4轮 线索: 正式通告 猜测: 公告 | 第5轮 线索: 提前让他知道 猜测: 预告,10,,False,14.81,2025-07-22 22:16:57,chinese,openhownet,告诉|东西|事物|物品|概念,2,
193,13,朽坏,verb,chinese_general,openai/gpt-4o,openai/gpt-4o,False,5,None,猜测生成失败: 格式验证失败: [腐烂],None,None,False,时间久了木头会这样 | 这种状态常见于古老建筑 | 食物放太久会变成这样 | 这种状态常见于被遗忘的物件 | 自然界中常见的分解过程,腐朽 | 老化 | 变质 | 陈旧,第1轮 线索: 时间久了木头会这样 猜测: 腐朽 | 第2轮 线索: 这种状态常见于古老建筑 猜测: 老化 | 第3轮 线索: 食物放太久会变成这样 猜测: 变质 | 第4轮 线索: 这种状态常见于被遗忘的物件 猜测: 陈旧,13,,False,11.84,2025-07-22 22:17:09,chinese,openhownet,衰败|东西|事物|物品|概念,2,
194,13,朽坏,verb,chinese_general,openai/gpt-4o,google/gemini-2.5-flash,False,5,腐烂,MAX_TURNS_EXCEEDED,None,None,False,时间久了木头会怎样 | 食物过期后会发生的状态 | 古老建筑常见的问题之一 | 铁器长期暴露在空气中会怎样? | 木材长期受潮后的状态,腐朽 | 变质 | 朽烂 | 生锈 | 腐烂,第1轮 线索: 时间久了木头会怎样 猜测: 腐朽 | 第2轮 线索: 食物过期后会发生的状态 猜测: 变质 | 第3轮 线索: 古老建筑常见的问题之一 猜测: 朽烂 | 第4轮 线索: 铁器长期暴露在空气中会怎样? 猜测: 生锈 | 第5轮 线索: 木材长期受潮后的状态 猜测: 腐烂,10,,False,11.56,2025-07-22 22:17:21,chinese,openhownet,衰败|东西|事物|物品|概念,2,
195,13,朽坏,verb,chinese_general,openai/gpt-4o,deepseek/deepseek-chat-v3-0324,False,5,老化,MAX_TURNS_EXCEEDED,None,None,False,食物时间长了会这样 | 木头长时间暴露在雨中会这样 | 古老建筑年久失修后的状态 | 铁器长时间不保养会这样 | 时间久了会失去原有的功能,变质 | 腐烂 | 破败 | 生锈 | 老化,第1轮 线索: 食物时间长了会这样 猜测: 变质 | 第2轮 线索: 木头长时间暴露在雨中会这样 猜测: 腐烂 | 第3轮 线索: 古老建筑年久失修后的状态 猜测: 破败 | 第4轮 线索: 铁器长时间不保养会这样 猜测: 生锈 | 第5轮 线索: 时间久了会失去原有的功能 猜测: 老化,11,,False,17.46,2025-07-22 22:17:39,chinese,openhownet,衰败|东西|事物|物品|概念,2,
196,13,朽坏,verb,chinese_general,openai/gpt-4o,moonshotai/kimi-k2,False,5,贬值,MAX_TURNS_EXCEEDED,None,None,False,长时间不用会变质的状态 | 时间久了会腐烂的状态 | 老化后失去原有功能的状态 | 长时间暴露于空气中会发生的状态 | 时间久了失去原有价值的状态,过期 | 腐烂 | 老化 | 变质 | 贬值,第1轮 线索: 长时间不用会变质的状态 猜测: 过期 | 第2轮 线索: 时间久了会腐烂的状态 猜测: 腐烂 | 第3轮 线索: 老化后失去原有功能的状态 猜测: 老化 | 第4轮 线索: 长时间暴露于空气中会发生的状态 猜测: 变质 | 第5轮 线索: 时间久了失去原有价值的状态 猜测: 贬值,11,,False,12.16,2025-07-22 22:17:52,chinese,openhownet,衰败|东西|事物|物品|概念,2,
197,13,朽坏,verb,chinese_general,google/gemini-2.5-flash,openai/gpt-4o,False,5,枯萎,MAX_TURNS_EXCEEDED,None,None,False,木头放久了会变得不结实 | 时间让它失去原有的样子 | 房子没人住墙壁会这样 | 身体机能不再健全失去生命力 | 失去活力变得无用,腐朽 | 老化 | 破败 | 衰老 | 枯萎,第1轮 线索: 木头放久了会变得不结实 猜测: 腐朽 | 第2轮 线索: 时间让它失去原有的样子 猜测: 老化 | 第3轮 线索: 房子没人住墙壁会这样 猜测: 破败 | 第4轮 线索: 身体机能不再健全失去生命力 猜测: 衰老 | 第5轮 线索: 失去活力变得无用 猜测: 枯萎,14,,False,11.38,2025-07-22 22:18:04,chinese,openhownet,衰败|东西|事物|物品|概念,2,
198,13,朽坏,verb,chinese_general,google/gemini-2.5-flash,google/gemini-2.5-flash,True,4,朽坏,成功,None,None,False,木头放久了会变得不结实 | 房子没人住会变成这样 | 时间让它失去生命力 | 失去原有的坚固和完整,腐朽 | 破败 | 腐烂 | 朽坏,第1轮 线索: 木头放久了会变得不结实 猜测: 腐朽 | 第2轮 线索: 房子没人住会变成这样 猜测: 破败 | 第3轮 线索: 时间让它失去生命力 猜测: 腐烂 | 第4轮 线索: 失去原有的坚固和完整 猜测: 朽坏,8,,False,5.28,2025-07-22 22:18:10,chinese,openhownet,衰败|东西|事物|物品|概念,2,
199,13,朽坏,verb,chinese_general,google/gemini-2.5-flash,deepseek/deepseek-chat-v3-0324,False,5,报废,MAX_TURNS_EXCEEDED,None,None,False,木头放久了会这样变得不结实 | 机器用久了也会这样 | 身体机能变差不能用了 | 失去生命力变得破旧不堪 | 时间让它变得不能用,腐朽 | 老化 | 衰老 | 破旧 | 报废,第1轮 线索: 木头放久了会这样变得不结实 猜测: 腐朽 | 第2轮 线索: 机器用久了也会这样 猜测: 老化 | 第3轮 线索: 身体机能变差不能用了 猜测: 衰老 | 第4轮 线索: 失去生命力变得破旧不堪 猜测: 破旧 | 第5轮 线索: 时间让它变得不能用 猜测: 报废,12,,False,17.66,2025-07-22 22:18:28,chinese,openhownet,衰败|东西|事物|物品|概念,2,
200,13,朽坏,verb,chinese_general,google/gemini-2.5-flash,moonshotai/kimi-k2,False,5,衰落,MAX_TURNS_EXCEEDED,None,None,False,木头放久了会这样变得不结实 | 身体机能变差不能用了 | 机器用久了会这样 | 失去活力渐渐消亡 | 精神或组织失去生命力,腐朽 | 老化 | 老化 | 衰败 | 衰落,第1轮 线索: 木头放久了会这样变得不结实 猜测: 腐朽 | 第2轮 线索: 身体机能变差不能用了 猜测: 老化 | 第3轮 线索: 机器用久了会这样 猜测: 老化 | 第4轮 线索: 失去活力渐渐消亡 猜测: 衰败 | 第5轮 线索: 精神或组织失去生命力 猜测: 衰落,10,,False,9.65,2025-07-22 22:18:38,chinese,openhownet,衰败|东西|事物|物品|概念,2,
201,13,朽坏,verb,chinese_general,deepseek/deepseek-chat-v3-0324,openai/gpt-4o,False,5,腐烂,MAX_TURNS_EXCEEDED,None,None,False,木头时间久了会怎样 | 食物过期后的状态 | 金属生锈是类似的自然变化  [线索] 古籍存放不当容易出现的情况  [线索] 形容建筑年久失修的状态 | 有机材料自然分解的过程  [线索] 形容木材被虫蛀后的状态  [线索] 长期潮湿导致的结果  [线索] 不保养的皮革最终会这样 | 形容枯叶在泥土中的变化  [线索] 未经处理的纸张最终命运  [线索] 长期暴露在空气中的食物结局  [线索] 被遗忘的木质家具常见结局,腐烂 | 变质 | 老化 | 腐朽 | 腐烂,第1轮 线索: 木头时间久了会怎样 猜测: 腐烂 | 第2轮 线索: 食物过期后的状态 猜测: 变质 | 第3轮 线索: 金属生锈是类似的自然变化  [线索] 古籍存放不当容易出现的情况  [线索] 形容建筑年久失修的状态 猜测: 老化 | 第4轮 线索: 有机材料自然分解的过程  [线索] 形容木材被虫蛀后的状态  [线索] 长期潮湿导致的结果  [线索] 不保养的皮革最终会这样 猜测: 腐朽 | 第5轮 线索: 形容枯叶在泥土中的变化  [线索] 未经处理的纸张最终命运  [线索] 长期暴露在空气中的食物结局  [线索] 被遗忘的木质家具常见结局 猜测: 腐烂,11,,False,27.05,2025-07-22 22:19:05,chinese,openhownet,衰败|东西|事物|物品|概念,2,
202,13,朽坏,verb,chinese_general,deepseek/deepseek-chat-v3-0324,google/gemini-2.5-flash,False,2,None,猜测生成失败: 格式验证失败: [腐朽],None,None,False,木头久置失去原有性质 | 时间久了无法保持原样,朽木,第1轮 线索: 木头久置失去原有性质 猜测: 朽木,8,,False,7.5,2025-07-22 22:19:13,chinese,openhownet,衰败|东西|事物|物品|概念,2,
